videoid,duration,page_dir,name
661669727,PT00H00M01S,697914_152323,a woman is looking at something in the distance
429419894,PT00H00M01S,298724_922981,a boat is flying in the air
1068360229,PT00H00M02S,447717_222264,a boat is sinking in the water
141008639,PT00H00M01S,047152_443257,a cartoon character is on a boat in the water
1719350742,PT00H00M03S,908174_837978,a cartoon character is being covered by bubbles
1430381298,PT00H00M01S,161436_178420,a cartoon character with tears in his eyes
477550211,PT00H00M02S,049643_576591,a blue background with white circles and lines on it
134713741,PT00H00M05S,941112_869573,a plane is flying through the sky
407634364,PT00H00M16S,470786_606382,a man is laughing
1542625023,PT00H00M03S,420185_597001,a cartoon character is smiling
932065977,PT00H00M05S,856870_903636,a cartoon character with pink hair and glasses is talking to someone
784105504,PT00H00M10S,745686_560778,a cartoon character is sitting on a boat
1784416396,PT00H00M03S,078230_990732,a cartoon character is smiling
192609643,PT00H00M14S,904303_226689,a person is flying in the sky
1148760305,PT00H00M01S,460659_044808,a cartoon island with a large castle on top of it
1506044041,PT00H00M01S,970791_326589,a person is standing in a field
1449996742,PT00H00M07S,032753_218348,a cartoon character is shown with a green headband on his head
1836766312,PT00H00M04S,037367_163773,a close up of a man's face with a green bandana on his head
211766757,PT00H00M02S,675099_550845,a red logo on a black background
1798410742,PT00H01M09S,748606_053227,a cartoon character is standing in front of a body of water
1570331593,PT00H00M02S,431786_835896,a cartoon of one piece logo
1321271166,PT00H00M01S,925843_495451,two cartoon characters stand in front of a large door with the word marine written on it
1421436793,PT00H00M02S,403007_349972,a cartoon character is looking at the sky
1412727596,PT00H00M03S,191303_674153,a cartoon character is talking to another cartoon character
1413208000,PT00H00M02S,424364_449457,a man in a green hat is tied to a pole
187498222,PT00H00M03S,713363_108982,a cartoon character with a straw hat is talking
326925622,PT00H00M01S,045619_226485,a cartoon character with pink hair is talking to another character
1382906535,PT00H00M01S,688405_841896,two men are fighting with swords
1515962408,PT00H00M07S,142542_820047,a cartoon character is shooting a gun
648459975,PT00H00M03S,693450_612085,a cartoon character is shown pointing to the camera
903664557,PT00H00M01S,382511_534886,a man is speaking about the benefits of drinking water
